<models xmlns="http://www.usgs.gov/sparrow/meta_response/v0_1" xmlns:xsi="http://www.w3.org/2001/XMLSchema-instance" xsi:schemaLocation="http://www.usgs.gov/sparrow/meta_response/v0_1 http://www.usgs.gov/sparrow/meta_response.xsd">
	<model id="-1">
		<status>
			<approved>true</approved>
			<public>true</public>
			<archived>false</archived>
		</status>
		<!-- %s -->
		<name>test</name>
		<alias>test</alias>
		<description>Test Model</description>
		<dateAdded>2009-09-03</dateAdded>
		<contactId>21</contactId>
		<enhNetworkId>1</enhNetworkId>
		<bounds north="41.019231" west="-80.922115" south="36.519231" east="-74.172115"></bounds>
		<sources>
			<source id="30" identifier="1" sortOrder="1"><name>atdep_mean_res</name><displayName>Atm. deposition</displayName><constituent>Unknown</constituent><units>Unknown</units></source>
			<source id="31" identifier="2" sortOrder="2"><name>manfert_n</name><displayName>Fertilizer (manure)</displayName><constituent>Unknown</constituent><units>Unknown</units></source>
		</sources>
	</model>
</models>